2021-04-30 00:00:00,2021-05-03,2021-05-04,2021-05-05,2021-05-06,2021-05-07,2021-05-08,2021-05-09,2021-05-10,2021-05-11,2021-05-12,2021-05-13,2021-05-14,2021-05-15,2021-05-16,2021-05-17,2021-05-18,2021-05-19,2021-05-20,2021-05-21,2021-05-22,2021-05-23,2021-05-24,2021-05-25,2021-05-26,2021-05-27,2021-05-28,2021-05-29,2021-05-30,2021-05-31,2021-06-01,2021-06-02,2021-06-03,2021-06-04,2021-06-05,2021-06-06,2021-06-07,2021-06-08,2021-06-09,2021-06-10,2021-06-11,2021-06-12,2021-06-13,2021-06-14,2021-06-15,2021-06-16,2021-06-17,2021-06-18,2021-06-19,2021-06-20,2021-06-21,2021-06-22,2021-06-23,2021-06-24,2021-06-25 09:07:51.415066,2021-06-26 09:05:01.742698,2021-06-27 09:05:28.845521,2021-06-28 09:05:01.880170,2021-06-29 09:05:02.277891,2021-06-30 09:05:01.912378,2021-07-01 09:05:02.449444,2021-07-02 09:05:02.098680,2021-07-03 09:06:13.342290,2021-07-04 09:05:02.211422,2021-07-05 09:06:33.115230,2021-07-06 09:05:02.419644,2021-07-07 09:05:02.220688,2021-07-08 09:05:01.974586,2021-07-09 09:05:32.221080,2021-07-10 09:05:01.549459,2021-07-11 09:05:43.066305,2021-07-12 09:05:54.902096,2021-07-13 09:06:02.587085,2021-07-14 09:05:02.127105,2021-07-15 09:05:01.883804,2021-07-16 09:05:02.100355,2021-07-17 09:05:02.270917,2021-07-18 09:05:01.899649,2021-07-19 09:05:01.930534,2021-07-20 09:05:01.621603,2021-07-21 09:06:25.795101,2021-07-22 09:05:29.067389,2021-07-23 09:05:02.358970,2021-07-24 09:05:01.963277,2021-07-25 09:05:01.986483,2021-07-26 09:05:01.724643,2021-07-27 09:05:01.729924,2021-07-28 09:05:01.511485,2021-07-29 09:05:01.594116,2021-07-30 09:05:02.108281,2021-07-31 09:06:51.467677,2021-08-01 09:07:01.074118,2021-08-02 09:05:01.974715,2021-08-03 09:06:26.440037,2021-08-04 09:05:01.601616,2021-08-05 09:05:53.148533,2021-08-06 09:05:01.696532,2021-08-07 09:05:02.120633,2021-08-08 09:05:01.762272,2021-08-09 09:07:46.870191,2021-08-10 09:06:08.406362,2021-08-11 09:05:11.126501,2021-08-12 09:05:34.368189,2021-08-13 09:07:16.255637,2021-08-14 09:05:02.347925,2021-08-15 09:05:02.224957,2021-08-16 09:06:40.360366,2021-08-17 09:06:53.875731,2021-08-18 09:05:02.276952,2021-08-19 09:05:02.336223,2021-08-20 09:05:09.690789,2021-08-21 09:05:01.953230,2021-08-22 09:05:02.010869,2021-08-23 09:05:01.884580,2021-08-24 09:06:34.494293,2021-08-25 09:05:01.792299,2021-08-26 09:05:02.508764,2021-08-27 09:05:58.373172,2021-08-28 09:05:02.442320,2021-08-29 09:05:02.012982,2021-08-30 09:05:01.811673,2021-08-31 09:06:04.220274,2021-09-01 09:05:01.527061,2021-09-02 09:05:01.694348,2021-09-03 09:07:08.729681,2021-09-04 09:05:01.627202,2021-09-05 09:05:01.679548,2021-09-06 09:05:07.261617,2021-09-07 09:05:01.633890,2021-09-08 09:05:02.133624,2021-09-09 09:05:02.051603,2021-09-10 09:05:02.134179,2021-09-11 09:05:01.922176,2021-09-12 09:05:43.534761,2021-09-13 09:05:02.000669,2021-09-14 09:05:02.247737,2021-09-15 09:05:02.160015,2021-09-16 09:05:02.246672,2021-09-17 09:07:19.298468,2021-09-18 09:05:01.631725,2021-09-19 09:05:17.519057,2021-09-20 09:05:01.535844,2021-09-21 09:05:02.058733,2021-09-22 09:05:01.789964,2021-09-23 09:05:02.050841,2021-09-24 09:05:05.674058,2021-09-25 09:07:14.114513,2021-09-26 09:05:01.750978,2021-09-27 09:05:02.020856,2021-09-28 09:05:02.002872,2021-09-29 09:05:02.133072,2021-09-30 09:05:02.225521,2021-10-01 09:05:15.729262,2021-10-02 09:06:02.692969,2021-10-03 09:05:02.325510,2021-10-04 09:05:27.112559,2021-10-05 09:06:42.014345,2021-10-06 09:05:02.298850,2021-10-07 09:05:02.778939,2021-10-08 09:05:53.876180,2021-10-09 09:05:01.480447,2021-10-10 09:05:01.725101,2021-10-11 09:05:01.601345,2021-10-12 09:05:02.030938,2021-10-13 09:06:53.086819,2021-10-14 09:05:11.957006,2021-10-15 09:05:02.423601,2021-10-16 09:05:01.733021,2021-10-17 09:05:19.782002,2021-10-18 09:05:02.249849,2021-10-19 09:05:02.235296,2021-10-20 09:05:02.512640,2021-10-21 09:05:01.654114,2021-10-22 09:05:32.463373,2021-10-23 09:05:01.818467,2021-10-24 09:08:07.115558,2021-10-25 09:05:02.342331,2021-10-26 09:05:02.239053,2021-10-27 09:06:22.868054,2021-10-28 09:05:01.750687,2021-10-29 09:05:02.393681,2021-10-30 09:05:01.738675,2021-10-31 09:05:02.832599,2021-11-01 09:05:01.850107,2021-11-02 09:05:18.129218,2021-11-03 09:05:02.006477,2021-11-04 09:05:02.330606,2021-11-05 09:06:07.413045,2021-11-06 09:05:01.764008,2021-11-07 09:05:01.826516,2021-11-08 09:05:01.635808,2021-11-09 09:05:56.930433,2021-11-10 09:06:45.397660,2021-11-11 09:05:02.050106,2021-11-12 09:05:02.131607,2021-11-13 09:05:02.479239,2021-11-14 09:05:02.309972,2021-11-15 09:05:02.289106,2021-11-16 09:05:01.880434,2021-11-17 09:05:02.137998,2021-11-18 09:05:01.713704,2021-11-19 09:08:17.396075,2021-11-20 09:05:01.779402
"1, Big Baby Tape, kizaru, BANDANA I","1, Big Baby Tape, kizaru, BANDANA I","1, Big Baby Tape, kizaru, BANDANA I","1, Big Baby Tape, kizaru, BANDANA I","1, Big Baby Tape, kizaru, BANDANA I","1, Big Baby Tape, kizaru, BANDANA I","1, Big Baby Tape, kizaru, BANDANA I","1, Big Baby Tape, kizaru, BANDANA I","1, Big Baby Tape, kizaru, BANDANA I","1, Big Baby Tape, kizaru, BANDANA I","1, Big Baby Tape, kizaru, BANDANA I","1, Big Baby Tape, kizaru, BANDANA I","1, Big Baby Tape, kizaru, BANDANA I","1, Big Baby Tape, kizaru, BANDANA I","1, Big Baby Tape, kizaru, BANDANA I","1, Big Baby Tape, kizaru, BANDANA I","1, Big Baby Tape, kizaru, BANDANA I","1, Big Baby Tape, kizaru, BANDANA I","1, Big Baby Tape, kizaru, BANDANA I","1, Big Baby Tape, kizaru, BANDANA I","1, Big Baby Tape, kizaru, BANDANA I","1, Big Baby Tape, kizaru, BANDANA I","1, Big Baby Tape, kizaru, BANDANA I","1, Big Baby Tape, kizaru, BANDANA I","1, Big Baby Tape, kizaru, BANDANA I","1, Big Baby Tape, kizaru, BANDANA I","1, Big Baby Tape, kizaru, BANDANA I","1, Big Baby Tape, kizaru, BANDANA I","1, Big Baby Tape, kizaru, BANDANA I","1, Big Baby Tape, kizaru, BANDANA I","1, Big Baby Tape, kizaru, BANDANA I","1, Big Baby Tape, kizaru, BANDANA I","1, Big Baby Tape, kizaru, BANDANA I","1, Big Baby Tape, kizaru, BANDANA I","1, Big Baby Tape, kizaru, BANDANA I","1, Big Baby Tape, kizaru, BANDANA I","1, Big Baby Tape, kizaru, BANDANA I","1, Big Baby Tape, kizaru, BANDANA I","1, Big Baby Tape, kizaru, BANDANA I","1, Big Baby Tape, kizaru, BANDANA I","1, Big Baby Tape, kizaru, BANDANA I","1, Big Baby Tape, kizaru, BANDANA I","1, Big Baby Tape, kizaru, BANDANA I","1, Big Baby Tape, kizaru, BANDANA I","1, Big Baby Tape, kizaru, BANDANA I","1, Big Baby Tape, kizaru, BANDANA I","1, Big Baby Tape, kizaru, BANDANA I","1, Big Baby Tape, kizaru, BANDANA I","1, Big Baby Tape, kizaru, BANDANA I","1, Big Baby Tape, kizaru, BANDANA I","1, Big Baby Tape, kizaru, BANDANA I","1, Big Baby Tape, kizaru, BANDANA I","1, Big Baby Tape, kizaru, BANDANA I","1, Big Baby Tape, kizaru, BANDANA I","1, Big Baby Tape, kizaru, BANDANA I","1, Big Baby Tape, kizaru, BANDANA I","1, Big Baby Tape, kizaru, BANDANA I","1, Big Baby Tape, kizaru, BANDANA I","1, Big Baby Tape, kizaru, BANDANA I","1, Big Baby Tape, kizaru, BANDANA I","1, Big Baby Tape, kizaru, BANDANA I","1, Big Baby Tape, kizaru, BANDANA I","1, Big Baby Tape, kizaru, BANDANA I","1, Big Baby Tape, kizaru, BANDANA I","1, Big Baby Tape, kizaru, BANDANA I","1, Big Baby Tape, kizaru, BANDANA I","1, Big Baby Tape, kizaru, BANDANA I","1, Big Baby Tape, kizaru, BANDANA I","1, Big Baby Tape, kizaru, BANDANA I","1, Big Baby Tape, kizaru, BANDANA I","1, Big Baby Tape, kizaru, BANDANA I","1, Big Baby Tape, kizaru, BANDANA I","1, Big Baby Tape, kizaru, BANDANA I","1, Big Baby Tape, kizaru, BANDANA I","1, Big Baby Tape, kizaru, BANDANA I","1, Big Baby Tape, kizaru, BANDANA I","1, Big Baby Tape, kizaru, BANDANA I","1, Big Baby Tape, kizaru, BANDANA I","1, Big Baby Tape, kizaru, BANDANA I","1, Big Baby Tape, kizaru, BANDANA I","1, Big Baby Tape, kizaru, BANDANA I","1, Big Baby Tape, kizaru, BANDANA I","1, Big Baby Tape, kizaru, BANDANA I","1, Big Baby Tape, kizaru, BANDANA I","1, Big Baby Tape, kizaru, BANDANA I","1, Big Baby Tape, kizaru, BANDANA I","1, Big Baby Tape, kizaru, BANDANA I","1, Big Baby Tape, kizaru, BANDANA I","1, Big Baby Tape, kizaru, BANDANA I","1, Big Baby Tape, kizaru, BANDANA I","1, Big Baby Tape, kizaru, BANDANA I","1, Big Baby Tape, kizaru, BANDANA I","1, Big Baby Tape, kizaru, BANDANA I","1, Big Baby Tape, kizaru, BANDANA I","1, Big Baby Tape, kizaru, BANDANA I","1, Big Baby Tape, kizaru, BANDANA I","1, Big Baby Tape, kizaru, BANDANA I","1, Big Baby Tape, kizaru, BANDANA I","1, Big Baby Tape, kizaru, BANDANA I","1, Big Baby Tape, kizaru, BANDANA I","1, Big Baby Tape, kizaru, BANDANA I","1, Big Baby Tape, kizaru, BANDANA I","1, Big Baby Tape, kizaru, BANDANA I","1, Big Baby Tape, kizaru, BANDANA I","1, Big Baby Tape, kizaru, BANDANA I","1, Big Baby Tape, kizaru, BANDANA I","1, Big Baby Tape, kizaru, BANDANA I","1, Big Baby Tape, kizaru, BANDANA I","1, Big Baby Tape, kizaru, BANDANA I","1, Big Baby Tape, kizaru, BANDANA I","1, Big Baby Tape, kizaru, BANDANA I","1, Big Baby Tape, kizaru, BANDANA I","1, Big Baby Tape, kizaru, BANDANA I","1, Big Baby Tape, kizaru, BANDANA I","1, Big Baby Tape, kizaru, BANDANA I","1, Big Baby Tape, kizaru, BANDANA I","1, Big Baby Tape, kizaru, BANDANA I","1, Big Baby Tape, kizaru, BANDANA I","1, Big Baby Tape, kizaru, BANDANA I","1, Big Baby Tape, kizaru, BANDANA I","1, Big Baby Tape, kizaru, BANDANA I","1, Big Baby Tape, kizaru, BANDANA I","1, Big Baby Tape, kizaru, BANDANA I","1, Big Baby Tape, kizaru, BANDANA I","1, Big Baby Tape, kizaru, BANDANA I","1, Big Baby Tape, kizaru, BANDANA I","1, Big Baby Tape, kizaru, BANDANA I","1, Big Baby Tape, kizaru, BANDANA I","1, Big Baby Tape, kizaru, BANDANA I","1, Big Baby Tape, kizaru, BANDANA I","1, Big Baby Tape, kizaru, BANDANA I","1, Big Baby Tape, kizaru, BANDANA I","1, Big Baby Tape, kizaru, BANDANA I","1, Big Baby Tape, kizaru, BANDANA I","1, Big Baby Tape, kizaru, BANDANA I","1, Big Baby Tape, kizaru, BANDANA I","1, Big Baby Tape, kizaru, BANDANA I","1, Big Baby Tape, kizaru, BANDANA I","1, Big Baby Tape, kizaru, BANDANA I","1, Big Baby Tape, kizaru, BANDANA I","1, Big Baby Tape, kizaru, BANDANA I","1, Big Baby Tape, kizaru, BANDANA I","1, Big Baby Tape, kizaru, BANDANA I","1, Big Baby Tape, kizaru, BANDANA I","1, Big Baby Tape, kizaru, BANDANA I","1, Big Baby Tape, kizaru, BANDANA I","1, Big Baby Tape, kizaru, BANDANA I","1, Big Baby Tape, kizaru, BANDANA I","1, Big Baby Tape, kizaru, BANDANA I","1, Big Baby Tape, kizaru, BANDANA I","1, Big Baby Tape, kizaru, BANDANA I","1, Big Baby Tape, kizaru, BANDANA I","1, Big Baby Tape, kizaru, BANDANA I","1, Big Baby Tape, kizaru, BANDANA I","1, Big Baby Tape, kizaru, BANDANA I","1, Big Baby Tape, kizaru, BANDANA I","1, Big Baby Tape, kizaru, BANDANA I","1, Big Baby Tape, kizaru, BANDANA I","1, Big Baby Tape, kizaru, BANDANA I","1, Big Baby Tape, kizaru, BANDANA I","1, Big Baby Tape, kizaru, BANDANA I","1, Big Baby Tape, kizaru, BANDANA I","1, Big Baby Tape, kizaru, BANDANA I","1, Big Baby Tape, kizaru, BANDANA I","1, Big Baby Tape, kizaru, BANDANA I","1, Big Baby Tape, kizaru, BANDANA I","1, Big Baby Tape, kizaru, BANDANA I","1, Big Baby Tape, kizaru, BANDANA I","1, Big Baby Tape, kizaru, BANDANA I","1, Big Baby Tape, kizaru, BANDANA I","1, Big Baby Tape, kizaru, BANDANA I","1, Big Baby Tape, kizaru, BANDANA I","1, Big Baby Tape, kizaru, BANDANA I","1, Big Baby Tape, kizaru, BANDANA I","1, Big Baby Tape, kizaru, BANDANA I","1, Big Baby Tape, kizaru, BANDANA I","1, Big Baby Tape, kizaru, BANDANA I","1, Big Baby Tape, kizaru, BANDANA I","1, Big Baby Tape, kizaru, BANDANA I","1, Big Baby Tape, kizaru, BANDANA I","1, Big Baby Tape, kizaru, BANDANA I","1, Big Baby Tape, kizaru, BANDANA I","1, Big Baby Tape, kizaru, BANDANA I","1, Big Baby Tape, kizaru, BANDANA I","1, Big Baby Tape, kizaru, BANDANA I","1, Big Baby Tape, kizaru, BANDANA I","1, Big Baby Tape, kizaru, BANDANA I","1, Big Baby Tape, kizaru, BANDANA I","1, Big Baby Tape, kizaru, BANDANA I","1, Big Baby Tape, kizaru, BANDANA I","1, Big Baby Tape, kizaru, BANDANA I","1, Big Baby Tape, kizaru, BANDANA I","1, Big Baby Tape, kizaru, BANDANA I","1, Big Baby Tape, kizaru, BANDANA I","1, Big Baby Tape, kizaru, BANDANA I","1, Big Baby Tape, kizaru, BANDANA I","1, Big Baby Tape, kizaru, BANDANA I","1, Big Baby Tape, kizaru, BANDANA I","1, Big Baby Tape, kizaru, BANDANA I","1, Big Baby Tape, kizaru, BANDANA I","1, Big Baby Tape, kizaru, BANDANA I","1, Big Baby Tape, kizaru, BANDANA I","1, Big Baby Tape, kizaru, BANDANA I"
"2, Люся Чеботина, The End","2, Люся Чеботина, The End","2, Люся Чеботина, The End","2, Люся Чеботина, The End","2, Люся Чеботина, The End","2, Люся Чеботина, The End","2, Люся Чеботина, The End","2, Люся Чеботина, The End","2, Люся Чеботина, The End","2, Люся Чеботина, The End","2, Люся Чеботина, The End","2, Люся Чеботина, The End","2, Люся Чеботина, The End","2, Люся Чеботина, The End","2, Люся Чеботина, The End","2, Люся Чеботина, The End","2, Люся Чеботина, The End","2, Люся Чеботина, The End","2, Люся Чеботина, The End","2, Люся Чеботина, The End","2, Люся Чеботина, The End","2, Люся Чеботина, The End","2, Люся Чеботина, The End","2, Люся Чеботина, The End","2, Люся Чеботина, The End","2, Люся Чеботина, The End","2, Люся Чеботина, The End","2, Люся Чеботина, The End","2, Люся Чеботина, The End","2, Люся Чеботина, The End","2, Люся Чеботина, The End","2, Люся Чеботина, The End","2, Люся Чеботина, The End","2, Люся Чеботина, The End","2, Люся Чеботина, The End","2, Люся Чеботина, The End","2, Люся Чеботина, The End","2, Люся Чеботина, The End","2, Люся Чеботина, The End","2, Люся Чеботина, The End","2, Люся Чеботина, The End","2, Люся Чеботина, The End","2, Люся Чеботина, The End","2, Люся Чеботина, The End","2, Люся Чеботина, The End","2, Люся Чеботина, The End","2, Люся Чеботина, The End","2, Люся Чеботина, The End","2, Люся Чеботина, The End","2, Люся Чеботина, The End","2, Люся Чеботина, The End","2, Люся Чеботина, The End","2, Люся Чеботина, The End","2, Люся Чеботина, The End","2, Люся Чеботина, The End","2, Люся Чеботина, The End","2, Люся Чеботина, The End","2, Люся Чеботина, The End","2, Люся Чеботина, The End","2, Люся Чеботина, The End","2, Люся Чеботина, The End","2, Люся Чеботина, The End","2, Люся Чеботина, The End","2, Люся Чеботина, The End","2, Люся Чеботина, The End","2, Люся Чеботина, The End","2, Люся Чеботина, The End","2, Люся Чеботина, The End","2, Люся Чеботина, The End","2, Люся Чеботина, The End","2, Люся Чеботина, The End","2, Люся Чеботина, The End","2, Люся Чеботина, The End","2, Люся Чеботина, The End","2, Люся Чеботина, The End","2, Люся Чеботина, The End","2, Люся Чеботина, The End","2, Люся Чеботина, The End","2, Люся Чеботина, The End","2, Люся Чеботина, The End","2, Люся Чеботина, The End","2, Люся Чеботина, The End","2, Люся Чеботина, The End","2, Люся Чеботина, The End","2, Люся Чеботина, The End","2, Люся Чеботина, The End","2, Люся Чеботина, The End","2, Люся Чеботина, The End","2, Люся Чеботина, The End","2, Люся Чеботина, The End","2, Люся Чеботина, The End","2, Люся Чеботина, The End","2, Люся Чеботина, The End","2, Люся Чеботина, The End","2, Люся Чеботина, The End","2, Люся Чеботина, The End","2, Люся Чеботина, The End","2, Люся Чеботина, The End","2, Люся Чеботина, The End","2, Люся Чеботина, The End","2, Люся Чеботина, The End","2, Люся Чеботина, The End","2, Люся Чеботина, The End","2, Люся Чеботина, The End","2, Люся Чеботина, The End","2, Люся Чеботина, The End","2, Люся Чеботина, The End","2, Люся Чеботина, The End","2, Люся Чеботина, The End","2, Люся Чеботина, The End","2, Люся Чеботина, The End","2, Люся Чеботина, The End","2, Люся Чеботина, The End","2, Люся Чеботина, The End","2, Люся Чеботина, The End","2, Люся Чеботина, The End","2, Люся Чеботина, The End","2, Люся Чеботина, The End","2, Люся Чеботина, The End","2, Люся Чеботина, The End","2, Люся Чеботина, The End","2, Люся Чеботина, The End","2, Люся Чеботина, The End","2, Люся Чеботина, The End","2, Люся Чеботина, The End","2, Люся Чеботина, The End","2, Люся Чеботина, The End","2, Люся Чеботина, The End","2, Люся Чеботина, The End","2, Люся Чеботина, The End","2, Люся Чеботина, The End","2, Люся Чеботина, The End","2, Люся Чеботина, The End","2, Люся Чеботина, The End","2, Люся Чеботина, The End","2, Люся Чеботина, The End","2, Люся Чеботина, The End","2, Люся Чеботина, The End","2, Люся Чеботина, The End","2, Люся Чеботина, The End","2, Люся Чеботина, The End","2, Люся Чеботина, The End","2, Люся Чеботина, The End","2, Люся Чеботина, The End","2, Люся Чеботина, The End","2, Люся Чеботина, The End","2, Люся Чеботина, The End","2, Люся Чеботина, The End","2, Люся Чеботина, The End","2, Люся Чеботина, The End","2, Люся Чеботина, The End","2, Люся Чеботина, The End","2, Люся Чеботина, The End","2, Люся Чеботина, The End","2, Люся Чеботина, The End","2, Люся Чеботина, The End","2, Люся Чеботина, The End","2, Люся Чеботина, The End","2, Люся Чеботина, The End","2, Люся Чеботина, The End","2, Люся Чеботина, The End","2, Люся Чеботина, The End","2, Люся Чеботина, The End","2, Люся Чеботина, The End","2, Люся Чеботина, The End","2, Люся Чеботина, The End","2, Люся Чеботина, The End","2, Люся Чеботина, The End","2, Люся Чеботина, The End","2, Люся Чеботина, The End","2, Люся Чеботина, The End","2, Люся Чеботина, The End","2, Люся Чеботина, The End","2, Люся Чеботина, The End","2, Люся Чеботина, The End","2, Люся Чеботина, The End","2, Люся Чеботина, The End","2, Люся Чеботина, The End","2, Люся Чеботина, The End","2, Люся Чеботина, The End","2, Люся Чеботина, The End","2, Люся Чеботина, The End","2, Люся Чеботина, The End","2, Люся Чеботина, The End","2, Люся Чеботина, The End","2, Люся Чеботина, The End","2, Люся Чеботина, The End","2, Люся Чеботина, The End","2, Люся Чеботина, The End","2, Люся Чеботина, The End","2, Люся Чеботина, The End","2, Люся Чеботина, The End","2, Люся Чеботина, The End","2, Люся Чеботина, The End","2, Люся Чеботина, The End","2, Люся Чеботина, The End","2, Люся Чеботина, The End","2, Люся Чеботина, The End","2, Люся Чеботина, The End","2, Люся Чеботина, The End","2, Люся Чеботина, The End","2, Люся Чеботина, The End","2, Люся Чеботина, The End"
"3, MACAN, SOLO","3, MACAN, SOLO","3, MACAN, SOLO","3, MACAN, SOLO","3, MACAN, SOLO","3, MACAN, SOLO","3, MACAN, SOLO","3, MACAN, SOLO","3, MACAN, SOLO","3, MACAN, SOLO","3, MACAN, SOLO","3, MACAN, SOLO","3, MACAN, SOLO","3, MACAN, SOLO","3, MACAN, SOLO","3, MACAN, SOLO","3, MACAN, SOLO","3, MACAN, SOLO","3, MACAN, SOLO","3, MACAN, SOLO","3, MACAN, SOLO","3, MACAN, SOLO","3, MACAN, SOLO","3, MACAN, SOLO","3, MACAN, SOLO","3, MACAN, SOLO","3, MACAN, SOLO","3, MACAN, SOLO","3, MACAN, SOLO","3, MACAN, SOLO","3, MACAN, SOLO","3, MACAN, SOLO","3, MACAN, SOLO","3, MACAN, SOLO","3, MACAN, SOLO","3, MACAN, SOLO","3, MACAN, SOLO","3, MACAN, SOLO","3, MACAN, SOLO","3, MACAN, SOLO","3, MACAN, SOLO","3, MACAN, SOLO","3, MACAN, SOLO","3, MACAN, SOLO","3, MACAN, SOLO","3, MACAN, SOLO","3, MACAN, SOLO","3, MACAN, SOLO","3, MACAN, SOLO","3, MACAN, SOLO","3, MACAN, SOLO","3, MACAN, SOLO","3, MACAN, SOLO","3, MACAN, SOLO","3, MACAN, SOLO","3, MACAN, SOLO","3, MACAN, SOLO","3, MACAN, SOLO","3, MACAN, SOLO","3, MACAN, SOLO","3, MACAN, SOLO","3, MACAN, SOLO","3, MACAN, SOLO","3, MACAN, SOLO","3, MACAN, SOLO","3, MACAN, SOLO","3, MACAN, SOLO","3, MACAN, SOLO","3, MACAN, SOLO","3, MACAN, SOLO","3, MACAN, SOLO","3, MACAN, SOLO","3, MACAN, SOLO","3, MACAN, SOLO","3, MACAN, SOLO","3, MACAN, SOLO","3, MACAN, SOLO","3, MACAN, SOLO","3, MACAN, SOLO","3, MACAN, SOLO","3, MACAN, SOLO","3, MACAN, SOLO","3, MACAN, SOLO","3, MACAN, SOLO","3, MACAN, SOLO","3, MACAN, SOLO","3, MACAN, SOLO","3, MACAN, SOLO","3, MACAN, SOLO","3, MACAN, SOLO","3, MACAN, SOLO","3, MACAN, SOLO","3, MACAN, SOLO","3, MACAN, SOLO","3, MACAN, SOLO","3, MACAN, SOLO","3, MACAN, SOLO","3, MACAN, SOLO","3, MACAN, SOLO","3, MACAN, SOLO","3, MACAN, SOLO","3, MACAN, SOLO","3, MACAN, SOLO","3, MACAN, SOLO","3, MACAN, SOLO","3, MACAN, SOLO","3, MACAN, SOLO","3, MACAN, SOLO","3, MACAN, SOLO","3, MACAN, SOLO","3, MACAN, SOLO","3, MACAN, SOLO","3, MACAN, SOLO","3, MACAN, SOLO","3, MACAN, SOLO","3, MACAN, SOLO","3, MACAN, SOLO","3, MACAN, SOLO","3, MACAN, SOLO","3, MACAN, SOLO","3, MACAN, SOLO","3, MACAN, SOLO","3, MACAN, SOLO","3, MACAN, SOLO","3, MACAN, SOLO","3, MACAN, SOLO","3, MACAN, SOLO","3, MACAN, SOLO","3, MACAN, SOLO","3, MACAN, SOLO","3, MACAN, SOLO","3, MACAN, SOLO","3, MACAN, SOLO","3, MACAN, SOLO","3, MACAN, SOLO","3, MACAN, SOLO","3, MACAN, SOLO","3, MACAN, SOLO","3, MACAN, SOLO","3, MACAN, SOLO","3, MACAN, SOLO","3, MACAN, SOLO","3, MACAN, SOLO","3, MACAN, SOLO","3, MACAN, SOLO","3, MACAN, SOLO","3, MACAN, SOLO","3, MACAN, SOLO","3, MACAN, SOLO","3, MACAN, SOLO","3, MACAN, SOLO","3, MACAN, SOLO","3, MACAN, SOLO","3, MACAN, SOLO","3, MACAN, SOLO","3, MACAN, SOLO","3, MACAN, SOLO","3, MACAN, SOLO","3, MACAN, SOLO","3, MACAN, SOLO","3, MACAN, SOLO","3, MACAN, SOLO","3, MACAN, SOLO","3, MACAN, SOLO","3, MACAN, SOLO","3, MACAN, SOLO","3, MACAN, SOLO","3, MACAN, SOLO","3, MACAN, SOLO","3, MACAN, SOLO","3, MACAN, SOLO","3, MACAN, SOLO","3, MACAN, SOLO","3, MACAN, SOLO","3, MACAN, SOLO","3, MACAN, SOLO","3, MACAN, SOLO","3, MACAN, SOLO","3, MACAN, SOLO","3, MACAN, SOLO","3, MACAN, SOLO","3, MACAN, SOLO","3, MACAN, SOLO","3, MACAN, SOLO","3, MACAN, SOLO","3, MACAN, SOLO","3, MACAN, SOLO","3, MACAN, SOLO","3, MACAN, SOLO","3, MACAN, SOLO","3, MACAN, SOLO","3, MACAN, SOLO","3, MACAN, SOLO","3, MACAN, SOLO","3, MACAN, SOLO","3, MACAN, SOLO","3, MACAN, SOLO","3, MACAN, SOLO","3, MACAN, SOLO","3, MACAN, SOLO","3, MACAN, SOLO","3, MACAN, SOLO","3, MACAN, SOLO"
