"52, Young Thug, Punk","52, Young Thug, Punk","52, Young Thug, Punk","52, Young Thug, Punk","52, Young Thug, Punk","52, Young Thug, Punk","52, Young Thug, Punk","52, Young Thug, Punk","52, Young Thug, Punk","52, Young Thug, Punk","52, Young Thug, Punk","52, Young Thug, Punk","52, Young Thug, Punk","52, Young Thug, Punk","52, Young Thug, Punk","52, Young Thug, Punk","52, Young Thug, Punk","52, Young Thug, Punk","52, Young Thug, Punk","52, Young Thug, Punk","52, Young Thug, Punk","52, Young Thug, Punk","52, Young Thug, Punk","52, Young Thug, Punk","52, Young Thug, Punk","52, Young Thug, Punk","52, Young Thug, Punk","52, Young Thug, Punk","52, Young Thug, Punk","52, Young Thug, Punk","52, Young Thug, Punk","52, Young Thug, Punk","52, Young Thug, Punk","52, Young Thug, Punk","52, Young Thug, Punk","52, Young Thug, Punk","52, Young Thug, Punk","52, Young Thug, Punk","52, Young Thug, Punk","52, Young Thug, Punk","52, Young Thug, Punk","52, Young Thug, Punk","52, Young Thug, Punk","52, Young Thug, Punk","52, Young Thug, Punk","52, Young Thug, Punk","52, Young Thug, Punk","52, Young Thug, Punk","52, Young Thug, Punk","52, Young Thug, Punk","52, Young Thug, Punk","52, Young Thug, Punk","52, Young Thug, Punk","52, Young Thug, Punk","52, Young Thug, Punk","52, Young Thug, Punk","52, Young Thug, Punk","52, Young Thug, Punk","52, Young Thug, Punk","52, Young Thug, Punk","52, Young Thug, Punk","52, Young Thug, Punk","52, Young Thug, Punk","52, Young Thug, Punk","52, Young Thug, Punk","52, Young Thug, Punk","52, Young Thug, Punk","52, Young Thug, Punk","52, Young Thug, Punk","52, Young Thug, Punk","52, Young Thug, Punk","52, Young Thug, Punk","52, Young Thug, Punk","52, Young Thug, Punk","52, Young Thug, Punk","52, Young Thug, Punk","52, Young Thug, Punk","52, Young Thug, Punk","52, Young Thug, Punk","52, Young Thug, Punk","52, Young Thug, Punk","52, Young Thug, Punk","52, Young Thug, Punk","52, Young Thug, Punk","52, Young Thug, Punk","52, Young Thug, Punk","52, Young Thug, Punk","52, Young Thug, Punk","52, Young Thug, Punk","52, Young Thug, Punk","52, Young Thug, Punk","52, Young Thug, Punk","52, Young Thug, Punk","52, Young Thug, Punk","52, Young Thug, Punk","52, Young Thug, Punk","52, Young Thug, Punk","52, Young Thug, Punk","52, Young Thug, Punk","52, Young Thug, Punk","52, Young Thug, Punk","52, Young Thug, Punk","52, Young Thug, Punk","52, Young Thug, Punk","52, Young Thug, Punk","52, Young Thug, Punk","52, Young Thug, Punk","52, Young Thug, Punk","52, Young Thug, Punk","52, Young Thug, Punk","52, Young Thug, Punk","52, Young Thug, Punk","52, Young Thug, Punk","52, Young Thug, Punk","52, Young Thug, Punk","52, Young Thug, Punk","52, Young Thug, Punk","52, Young Thug, Punk","52, Young Thug, Punk","52, Young Thug, Punk","52, Young Thug, Punk","52, Young Thug, Punk","52, Young Thug, Punk","52, Young Thug, Punk","52, Young Thug, Punk","52, Young Thug, Punk","52, Young Thug, Punk","52, Young Thug, Punk","52, Young Thug, Punk","52, Young Thug, Punk","52, Young Thug, Punk","52, Young Thug, Punk","52, Young Thug, Punk","52, Young Thug, Punk","52, Young Thug, Punk","52, Young Thug, Punk","52, Young Thug, Punk","52, Young Thug, Punk","52, Young Thug, Punk","52, Young Thug, Punk","52, Young Thug, Punk","52, Young Thug, Punk","52, Young Thug, Punk","52, Young Thug, Punk","52, Young Thug, Punk","52, Young Thug, Punk","52, Young Thug, Punk","52, Young Thug, Punk","52, Young Thug, Punk","52, Young Thug, Punk","52, Young Thug, Punk","52, Young Thug, Punk","52, Young Thug, Punk","52, Young Thug, Punk","52, Young Thug, Punk","52, Young Thug, Punk","52, Young Thug, Punk","52, Young Thug, Punk","52, Young Thug, Punk","52, Young Thug, Punk","52, Young Thug, Punk","52, Young Thug, Punk","52, Young Thug, Punk","52, Young Thug, Punk","52, Young Thug, Punk","52, Young Thug, Punk","52, Young Thug, Punk","52, Young Thug, Punk","52, Young Thug, Punk","52, Young Thug, Punk"
"53, Andy Panda, King Kong","53, Andy Panda, King Kong","53, Andy Panda, King Kong","53, Andy Panda, King Kong","53, Andy Panda, King Kong","53, Andy Panda, King Kong","53, Andy Panda, King Kong","53, Andy Panda, King Kong","53, Andy Panda, King Kong","53, Andy Panda, King Kong","53, Andy Panda, King Kong","53, Andy Panda, King Kong","53, Andy Panda, King Kong","53, Andy Panda, King Kong","53, Andy Panda, King Kong","53, Andy Panda, King Kong","53, Andy Panda, King Kong","53, Andy Panda, King Kong","53, Andy Panda, King Kong","53, Andy Panda, King Kong","53, Andy Panda, King Kong","53, Andy Panda, King Kong","53, Andy Panda, King Kong","53, Andy Panda, King Kong","53, Andy Panda, King Kong","53, Andy Panda, King Kong","53, Andy Panda, King Kong","53, Andy Panda, King Kong","53, Andy Panda, King Kong","53, Andy Panda, King Kong","53, Andy Panda, King Kong","53, Andy Panda, King Kong","53, Andy Panda, King Kong","53, Andy Panda, King Kong","53, Andy Panda, King Kong","53, Andy Panda, King Kong","53, Andy Panda, King Kong","53, Andy Panda, King Kong","53, Andy Panda, King Kong","53, Andy Panda, King Kong","53, Andy Panda, King Kong","53, Andy Panda, King Kong","53, Andy Panda, King Kong","53, Andy Panda, King Kong","53, Andy Panda, King Kong","53, Andy Panda, King Kong","53, Andy Panda, King Kong","53, Andy Panda, King Kong","53, Andy Panda, King Kong","53, Andy Panda, King Kong","53, Andy Panda, King Kong","53, Andy Panda, King Kong","53, Andy Panda, King Kong","53, Andy Panda, King Kong","53, Andy Panda, King Kong","53, Andy Panda, King Kong","53, Andy Panda, King Kong","53, Andy Panda, King Kong","53, Andy Panda, King Kong","53, Andy Panda, King Kong","53, Andy Panda, King Kong","53, Andy Panda, King Kong","53, Andy Panda, King Kong","53, Andy Panda, King Kong","53, Andy Panda, King Kong","53, Andy Panda, King Kong","53, Andy Panda, King Kong","53, Andy Panda, King Kong","53, Andy Panda, King Kong","53, Andy Panda, King Kong","53, Andy Panda, King Kong","53, Andy Panda, King Kong","53, Andy Panda, King Kong","53, Andy Panda, King Kong","53, Andy Panda, King Kong","53, Andy Panda, King Kong","53, Andy Panda, King Kong","53, Andy Panda, King Kong","53, Andy Panda, King Kong","53, Andy Panda, King Kong","53, Andy Panda, King Kong","53, Andy Panda, King Kong","53, Andy Panda, King Kong","53, Andy Panda, King Kong","53, Andy Panda, King Kong","53, Andy Panda, King Kong","53, Andy Panda, King Kong","53, Andy Panda, King Kong","53, Andy Panda, King Kong","53, Andy Panda, King Kong","53, Andy Panda, King Kong","53, Andy Panda, King Kong","53, Andy Panda, King Kong","53, Andy Panda, King Kong","53, Andy Panda, King Kong","53, Andy Panda, King Kong","53, Andy Panda, King Kong","53, Andy Panda, King Kong","53, Andy Panda, King Kong","53, Andy Panda, King Kong","53, Andy Panda, King Kong","53, Andy Panda, King Kong","53, Andy Panda, King Kong","53, Andy Panda, King Kong","53, Andy Panda, King Kong","53, Andy Panda, King Kong","53, Andy Panda, King Kong","53, Andy Panda, King Kong","53, Andy Panda, King Kong","53, Andy Panda, King Kong","53, Andy Panda, King Kong","53, Andy Panda, King Kong","53, Andy Panda, King Kong","53, Andy Panda, King Kong","53, Andy Panda, King Kong","53, Andy Panda, King Kong","53, Andy Panda, King Kong","53, Andy Panda, King Kong","53, Andy Panda, King Kong","53, Andy Panda, King Kong","53, Andy Panda, King Kong","53, Andy Panda, King Kong","53, Andy Panda, King Kong","53, Andy Panda, King Kong","53, Andy Panda, King Kong","53, Andy Panda, King Kong","53, Andy Panda, King Kong","53, Andy Panda, King Kong","53, Andy Panda, King Kong","53, Andy Panda, King Kong","53, Andy Panda, King Kong","53, Andy Panda, King Kong","53, Andy Panda, King Kong","53, Andy Panda, King Kong","53, Andy Panda, King Kong","53, Andy Panda, King Kong","53, Andy Panda, King Kong","53, Andy Panda, King Kong","53, Andy Panda, King Kong","53, Andy Panda, King Kong","53, Andy Panda, King Kong","53, Andy Panda, King Kong","53, Andy Panda, King Kong","53, Andy Panda, King Kong","53, Andy Panda, King Kong","53, Andy Panda, King Kong","53, Andy Panda, King Kong","53, Andy Panda, King Kong","53, Andy Panda, King Kong","53, Andy Panda, King Kong","53, Andy Panda, King Kong","53, Andy Panda, King Kong","53, Andy Panda, King Kong","53, Andy Panda, King Kong","53, Andy Panda, King Kong","53, Andy Panda, King Kong","53, Andy Panda, King Kong","53, Andy Panda, King Kong","53, Andy Panda, King Kong","53, Andy Panda, King Kong","53, Andy Panda, King Kong","53, Andy Panda, King Kong","53, Andy Panda, King Kong","53, Andy Panda, King Kong","53, Andy Panda, King Kong","53, Andy Panda, King Kong","53, Andy Panda, King Kong","53, Andy Panda, King Kong","53, Andy Panda, King Kong","53, Andy Panda, King Kong"
"54, Big Baby Tape, Dragonborn","54, Big Baby Tape, Dragonborn","54, Big Baby Tape, Dragonborn","54, Big Baby Tape, Dragonborn","54, Big Baby Tape, Dragonborn","54, Big Baby Tape, Dragonborn","54, Big Baby Tape, Dragonborn","54, Big Baby Tape, Dragonborn","54, Big Baby Tape, Dragonborn","54, Big Baby Tape, Dragonborn","54, Big Baby Tape, Dragonborn","54, Big Baby Tape, Dragonborn","54, Big Baby Tape, Dragonborn","54, Big Baby Tape, Dragonborn","54, Big Baby Tape, Dragonborn","54, Big Baby Tape, Dragonborn","54, Big Baby Tape, Dragonborn","54, Big Baby Tape, Dragonborn","54, Big Baby Tape, Dragonborn","54, Big Baby Tape, Dragonborn","54, Big Baby Tape, Dragonborn","54, Big Baby Tape, Dragonborn","54, Big Baby Tape, Dragonborn","54, Big Baby Tape, Dragonborn","54, Big Baby Tape, Dragonborn","54, Big Baby Tape, Dragonborn","54, Big Baby Tape, Dragonborn","54, Big Baby Tape, Dragonborn","54, Big Baby Tape, Dragonborn","54, Big Baby Tape, Dragonborn","54, Big Baby Tape, Dragonborn","54, Big Baby Tape, Dragonborn","54, Big Baby Tape, Dragonborn","54, Big Baby Tape, Dragonborn","54, Big Baby Tape, Dragonborn","54, Big Baby Tape, Dragonborn","54, Big Baby Tape, Dragonborn","54, Big Baby Tape, Dragonborn","54, Big Baby Tape, Dragonborn","54, Big Baby Tape, Dragonborn","54, Big Baby Tape, Dragonborn","54, Big Baby Tape, Dragonborn","54, Big Baby Tape, Dragonborn","54, Big Baby Tape, Dragonborn","54, Big Baby Tape, Dragonborn","54, Big Baby Tape, Dragonborn","54, Big Baby Tape, Dragonborn","54, Big Baby Tape, Dragonborn","54, Big Baby Tape, Dragonborn","54, Big Baby Tape, Dragonborn","54, Big Baby Tape, Dragonborn","54, Big Baby Tape, Dragonborn","54, Big Baby Tape, Dragonborn","54, Big Baby Tape, Dragonborn","54, Big Baby Tape, Dragonborn","54, Big Baby Tape, Dragonborn","54, Big Baby Tape, Dragonborn","54, Big Baby Tape, Dragonborn","54, Big Baby Tape, Dragonborn","54, Big Baby Tape, Dragonborn","54, Big Baby Tape, Dragonborn","54, Big Baby Tape, Dragonborn","54, Big Baby Tape, Dragonborn","54, Big Baby Tape, Dragonborn","54, Big Baby Tape, Dragonborn","54, Big Baby Tape, Dragonborn","54, Big Baby Tape, Dragonborn","54, Big Baby Tape, Dragonborn","54, Big Baby Tape, Dragonborn","54, Big Baby Tape, Dragonborn","54, Big Baby Tape, Dragonborn","54, Big Baby Tape, Dragonborn","54, Big Baby Tape, Dragonborn","54, Big Baby Tape, Dragonborn","54, Big Baby Tape, Dragonborn","54, Big Baby Tape, Dragonborn","54, Big Baby Tape, Dragonborn","54, Big Baby Tape, Dragonborn","54, Big Baby Tape, Dragonborn","54, Big Baby Tape, Dragonborn","54, Big Baby Tape, Dragonborn","54, Big Baby Tape, Dragonborn","54, Big Baby Tape, Dragonborn","54, Big Baby Tape, Dragonborn","54, Big Baby Tape, Dragonborn","54, Big Baby Tape, Dragonborn","54, Big Baby Tape, Dragonborn","54, Big Baby Tape, Dragonborn","54, Big Baby Tape, Dragonborn","54, Big Baby Tape, Dragonborn","54, Big Baby Tape, Dragonborn","54, Big Baby Tape, Dragonborn","54, Big Baby Tape, Dragonborn","54, Big Baby Tape, Dragonborn","54, Big Baby Tape, Dragonborn","54, Big Baby Tape, Dragonborn","54, Big Baby Tape, Dragonborn","54, Big Baby Tape, Dragonborn","54, Big Baby Tape, Dragonborn","54, Big Baby Tape, Dragonborn","54, Big Baby Tape, Dragonborn","54, Big Baby Tape, Dragonborn","54, Big Baby Tape, Dragonborn","54, Big Baby Tape, Dragonborn","54, Big Baby Tape, Dragonborn","54, Big Baby Tape, Dragonborn","54, Big Baby Tape, Dragonborn","54, Big Baby Tape, Dragonborn","54, Big Baby Tape, Dragonborn","54, Big Baby Tape, Dragonborn","54, Big Baby Tape, Dragonborn","54, Big Baby Tape, Dragonborn","54, Big Baby Tape, Dragonborn","54, Big Baby Tape, Dragonborn","54, Big Baby Tape, Dragonborn","54, Big Baby Tape, Dragonborn","54, Big Baby Tape, Dragonborn","54, Big Baby Tape, Dragonborn","54, Big Baby Tape, Dragonborn","54, Big Baby Tape, Dragonborn","54, Big Baby Tape, Dragonborn","54, Big Baby Tape, Dragonborn","54, Big Baby Tape, Dragonborn","54, Big Baby Tape, Dragonborn","54, Big Baby Tape, Dragonborn","54, Big Baby Tape, Dragonborn","54, Big Baby Tape, Dragonborn","54, Big Baby Tape, Dragonborn","54, Big Baby Tape, Dragonborn","54, Big Baby Tape, Dragonborn","54, Big Baby Tape, Dragonborn","54, Big Baby Tape, Dragonborn","54, Big Baby Tape, Dragonborn","54, Big Baby Tape, Dragonborn","54, Big Baby Tape, Dragonborn","54, Big Baby Tape, Dragonborn","54, Big Baby Tape, Dragonborn","54, Big Baby Tape, Dragonborn","54, Big Baby Tape, Dragonborn","54, Big Baby Tape, Dragonborn","54, Big Baby Tape, Dragonborn","54, Big Baby Tape, Dragonborn","54, Big Baby Tape, Dragonborn","54, Big Baby Tape, Dragonborn","54, Big Baby Tape, Dragonborn","54, Big Baby Tape, Dragonborn","54, Big Baby Tape, Dragonborn","54, Big Baby Tape, Dragonborn","54, Big Baby Tape, Dragonborn","54, Big Baby Tape, Dragonborn","54, Big Baby Tape, Dragonborn","54, Big Baby Tape, Dragonborn","54, Big Baby Tape, Dragonborn","54, Big Baby Tape, Dragonborn","54, Big Baby Tape, Dragonborn","54, Big Baby Tape, Dragonborn","54, Big Baby Tape, Dragonborn","54, Big Baby Tape, Dragonborn","54, Big Baby Tape, Dragonborn","54, Big Baby Tape, Dragonborn","54, Big Baby Tape, Dragonborn","54, Big Baby Tape, Dragonborn","54, Big Baby Tape, Dragonborn","54, Big Baby Tape, Dragonborn","54, Big Baby Tape, Dragonborn","54, Big Baby Tape, Dragonborn","54, Big Baby Tape, Dragonborn","54, Big Baby Tape, Dragonborn","54, Big Baby Tape, Dragonborn","54, Big Baby Tape, Dragonborn"
"55, Король и Шут, Акустический альбом","55, Король и Шут, Акустический альбом","55, Король и Шут, Акустический альбом","55, Король и Шут, Акустический альбом","55, Король и Шут, Акустический альбом","55, Король и Шут, Акустический альбом","55, Король и Шут, Акустический альбом","55, Король и Шут, Акустический альбом","55, Король и Шут, Акустический альбом","55, Король и Шут, Акустический альбом","55, Король и Шут, Акустический альбом","55, Король и Шут, Акустический альбом","55, Король и Шут, Акустический альбом","55, Король и Шут, Акустический альбом","55, Король и Шут, Акустический альбом","55, Король и Шут, Акустический альбом","55, Король и Шут, Акустический альбом","55, Король и Шут, Акустический альбом","55, Король и Шут, Акустический альбом","55, Король и Шут, Акустический альбом","55, Король и Шут, Акустический альбом","55, Король и Шут, Акустический альбом","55, Король и Шут, Акустический альбом","55, Король и Шут, Акустический альбом","55, Король и Шут, Акустический альбом","55, Король и Шут, Акустический альбом","55, Король и Шут, Акустический альбом","55, Король и Шут, Акустический альбом","55, Король и Шут, Акустический альбом","55, Король и Шут, Акустический альбом","55, Король и Шут, Акустический альбом","55, Король и Шут, Акустический альбом","55, Король и Шут, Акустический альбом","55, Король и Шут, Акустический альбом","55, Король и Шут, Акустический альбом","55, Король и Шут, Акустический альбом","55, Король и Шут, Акустический альбом","55, Король и Шут, Акустический альбом","55, Король и Шут, Акустический альбом","55, Король и Шут, Акустический альбом","55, Король и Шут, Акустический альбом","55, Король и Шут, Акустический альбом","55, Король и Шут, Акустический альбом","55, Король и Шут, Акустический альбом","55, Король и Шут, Акустический альбом","55, Король и Шут, Акустический альбом","55, Король и Шут, Акустический альбом","55, Король и Шут, Акустический альбом","55, Король и Шут, Акустический альбом","55, Король и Шут, Акустический альбом","55, Король и Шут, Акустический альбом","55, Король и Шут, Акустический альбом","55, Король и Шут, Акустический альбом","55, Король и Шут, Акустический альбом","55, Король и Шут, Акустический альбом","55, Король и Шут, Акустический альбом","55, Король и Шут, Акустический альбом","55, Король и Шут, Акустический альбом","55, Король и Шут, Акустический альбом","55, Король и Шут, Акустический альбом","55, Король и Шут, Акустический альбом","55, Король и Шут, Акустический альбом","55, Король и Шут, Акустический альбом","55, Король и Шут, Акустический альбом","55, Король и Шут, Акустический альбом","55, Король и Шут, Акустический альбом","55, Король и Шут, Акустический альбом","55, Король и Шут, Акустический альбом","55, Король и Шут, Акустический альбом","55, Король и Шут, Акустический альбом","55, Король и Шут, Акустический альбом","55, Король и Шут, Акустический альбом","55, Король и Шут, Акустический альбом","55, Король и Шут, Акустический альбом","55, Король и Шут, Акустический альбом","55, Король и Шут, Акустический альбом","55, Король и Шут, Акустический альбом","55, Король и Шут, Акустический альбом","55, Король и Шут, Акустический альбом","55, Король и Шут, Акустический альбом","55, Король и Шут, Акустический альбом","55, Король и Шут, Акустический альбом","55, Король и Шут, Акустический альбом","55, Король и Шут, Акустический альбом","55, Король и Шут, Акустический альбом","55, Король и Шут, Акустический альбом","55, Король и Шут, Акустический альбом","55, Король и Шут, Акустический альбом","55, Король и Шут, Акустический альбом","55, Король и Шут, Акустический альбом","55, Король и Шут, Акустический альбом","55, Король и Шут, Акустический альбом","55, Король и Шут, Акустический альбом","55, Король и Шут, Акустический альбом","55, Король и Шут, Акустический альбом","55, Король и Шут, Акустический альбом","55, Король и Шут, Акустический альбом","55, Король и Шут, Акустический альбом","55, Король и Шут, Акустический альбом","55, Король и Шут, Акустический альбом","55, Король и Шут, Акустический альбом","55, Король и Шут, Акустический альбом","55, Король и Шут, Акустический альбом","55, Король и Шут, Акустический альбом","55, Король и Шут, Акустический альбом","55, Король и Шут, Акустический альбом","55, Король и Шут, Акустический альбом","55, Король и Шут, Акустический альбом","55, Король и Шут, Акустический альбом","55, Король и Шут, Акустический альбом","55, Король и Шут, Акустический альбом","55, Король и Шут, Акустический альбом","55, Король и Шут, Акустический альбом","55, Король и Шут, Акустический альбом","55, Король и Шут, Акустический альбом","55, Король и Шут, Акустический альбом","55, Король и Шут, Акустический альбом","55, Король и Шут, Акустический альбом","55, Король и Шут, Акустический альбом","55, Король и Шут, Акустический альбом","55, Король и Шут, Акустический альбом","55, Король и Шут, Акустический альбом","55, Король и Шут, Акустический альбом","55, Король и Шут, Акустический альбом","55, Король и Шут, Акустический альбом","55, Король и Шут, Акустический альбом","55, Король и Шут, Акустический альбом","55, Король и Шут, Акустический альбом","55, Король и Шут, Акустический альбом","55, Король и Шут, Акустический альбом","55, Король и Шут, Акустический альбом","55, Король и Шут, Акустический альбом","55, Король и Шут, Акустический альбом","55, Король и Шут, Акустический альбом","55, Король и Шут, Акустический альбом","55, Король и Шут, Акустический альбом","55, Король и Шут, Акустический альбом","55, Король и Шут, Акустический альбом","55, Король и Шут, Акустический альбом","55, Король и Шут, Акустический альбом","55, Король и Шут, Акустический альбом","55, Король и Шут, Акустический альбом","55, Король и Шут, Акустический альбом","55, Король и Шут, Акустический альбом","55, Король и Шут, Акустический альбом","55, Король и Шут, Акустический альбом","55, Король и Шут, Акустический альбом","55, Король и Шут, Акустический альбом","55, Король и Шут, Акустический альбом","55, Король и Шут, Акустический альбом","55, Король и Шут, Акустический альбом","55, Король и Шут, Акустический альбом","55, Король и Шут, Акустический альбом","55, Король и Шут, Акустический альбом","55, Король и Шут, Акустический альбом","55, Король и Шут, Акустический альбом","55, Король и Шут, Акустический альбом","55, Король и Шут, Акустический альбом","55, Король и Шут, Акустический альбом","55, Король и Шут, Акустический альбом","55, Король и Шут, Акустический альбом","55, Король и Шут, Акустический альбом","55, Король и Шут, Акустический альбом","55, Король и Шут, Акустический альбом","55, Король и Шут, Акустический альбом","55, Король и Шут, Акустический альбом","55, Король и Шут, Акустический альбом","55, Король и Шут, Акустический альбом","55, Король и Шут, Акустический альбом","55, Король и Шут, Акустический альбом"
